Item,Risk
Focus,habitasse platea dictumst maecenas ut massa
XK Series,purus eu magna vulputate luctus cum
Discovery,odio condimentum id
Cutlass,quisque ut erat curabitur gravida
Camaro,vitae nisl aenean lectus pellentesque
2500,pede morbi porttitor
Taurus,maecenas tincidunt lacus at velit
Arnage,imperdiet sapien urna pretium nisl ut
Esprit,ante vestibulum ante ipsum primis in
SLK-Class,non velit donec
RX-7,cubilia curae duis faucibus accumsan
CTS,laoreet ut rhoncus aliquet pulvinar
NV1500,eget tincidunt eget
Esprit,volutpat sapien arcu sed
Coupe GT,amet erat nulla tempus
Legend,rutrum at lorem
Accord,at nulla suspendisse potenti cras in
Rodeo,sit amet erat nulla tempus vivamus
Suburban 2500,turpis integer aliquet
S-Class,vel lectus in quam
Sentra,tortor id nulla ultrices aliquet maecenas
Lancer Evolution,semper est quam pharetra magna ac
Crown Victoria,augue luctus tincidunt nulla
Suburban 1500,ut nunc vestibulum ante ipsum primis
Ridgeline,orci luctus et ultrices posuere
S-Class,quisque arcu libero rutrum ac lobortis
Firebird,congue diam id ornare imperdiet
Tribute,accumsan felis ut at dolor quis
Sidekick,eleifend donec ut
Truck,justo morbi ut odio cras
Vantage,nisl duis bibendum felis
Econoline E150,phasellus in felis donec semper sapien
4Runner,nonummy maecenas tincidunt lacus at
Silverado 2500,curabitur gravida nisi at nibh
RX,quis justo maecenas rhoncus aliquam lacus
Mustang,convallis nunc proin at turpis a
Thunderbird,at nibh in hac
Paseo,nisi vulputate nonummy maecenas tincidunt lacus
XC70,sapien placerat ante
911,purus phasellus in felis
Trans Sport,non sodales sed tincidunt
Colt,nullam porttitor lacus
SC,non velit nec nisi vulputate
Firebird,pharetra magna vestibulum
Patriot,facilisi cras non velit nec
Arnage,pede lobortis ligula sit amet
California,felis eu sapien cursus
C8 Spyder,ipsum primis in
Cavalier,amet erat nulla
GTO,tellus semper interdum mauris ullamcorper purus
Ram 2500,vestibulum proin eu mi nulla
Sonata,erat eros viverra eget congue
Monte Carlo,amet consectetuer adipiscing elit proin
Club Wagon,in leo maecenas pulvinar lobortis
Prizm,pretium nisl ut volutpat
Prelude,ut dolor morbi
Avanti,tortor id nulla ultrices aliquet maecenas
Edge,fringilla rhoncus mauris enim
Z3,leo odio porttitor id consequat
Range Rover,sit amet nulla quisque
xB,consequat in consequat ut nulla
Optima,sit amet nulla quisque
ZX2,velit id pretium iaculis diam erat
LS,tincidunt eget tempus
S-Class,risus auctor sed tristique
Integra,accumsan felis ut
M6,luctus rutrum nulla tellus in
Aviator,elementum pellentesque quisque porta
Integra,dapibus nulla suscipit
Reatta,turpis a pede posuere
RX,mi nulla ac
LTD Crown Victoria,id justo sit amet sapien
Town & Country,tellus nisi eu
Ram 2500,eget congue eget semper rutrum nulla
Safari,nulla ut erat id
C-Class,vestibulum quam sapien varius ut
Regal,nulla facilisi cras non
Silverado,montes nascetur ridiculus mus etiam vel
Tahoe,integer ac leo pellentesque ultrices mattis
Amanti,eu interdum eu tincidunt in
3500 Club Coupe,elementum eu interdum eu
350Z,ut suscipit a
LSS,vestibulum sit amet cursus
Legacy,semper porta volutpat
Intrigue,elit proin risus praesent
Ram 2500,est congue elementum
Explorer,ac est lacinia nisi
Ramcharger,sapien quis libero nullam sit
Elise,non quam nec dui
Impala,malesuada in imperdiet
164,commodo vulputate justo in blandit
Grand Prix Turbo,ante vel ipsum praesent blandit lacinia
F150,accumsan felis ut at dolor quis
240SX,interdum mauris non ligula
rio,augue vestibulum ante ipsum
GTO,nunc donec quis orci eget
Taurus,nullam molestie nibh in lectus pellentesque
Century,suspendisse accumsan tortor
5 Series,enim blandit mi in porttitor pede
GTI,lacus at turpis donec posuere
